<?xml version="1.0"?>
<!DOCTYPE ADDRESSLIST SYSTEM "AddressList.dtd">
<ADDRESSLIST>
 	<ADDRESS NAME="Miss. Ex M. Elle">
		<WORK>
		<STREET>22, WWW Street</STREET> 
	        <CITY>Cambridge</CITY>
		<STATE>MA</STATE>
		<COUNTRY>USA</COUNTRY>
		</WORK>
		<WORK>
		<STREET>44, Triple W Street</STREET>
	        <CITY>Cambridge</CITY>
		<STATE>MA</STATE>
		<COUNTRY>USA</COUNTRY>
		</WORK>
	</ADDRESS>
	<ADDRESS NAME="Mr. Ex S. Elle">
		<WORK>
			<STREET>34 WWW Street</STREET> 
	        	<CITY>Palo Alto</CITY>
			<STATE>CA</STATE>
			<COUNTRY>USA</COUNTRY>
		</WORK>
		<HOME>
		<STREET>23 WWW Street</STREET> 
	        <CITY>Palo Alto</CITY>
		<STATE>CA</STATE>
		<COUNTRY>USA</COUNTRY>
		</HOME>
	</ADDRESS>
</ADDRESSLIST>
